id,title,year,bases,problem,attack,methods,modeling
140,OPACITY OF FUZZY DISCRETE EVENT SYSTEMS,2019,IEEExplore-Scopus-Web of Science,verification,passive,Verification of Fuzzy Language and state based Opacity,fuzzy automata
141,OPACITY OF NETWORKED DISCRETE EVENT SYSTEMS,2019,IEEExplore-Scopus-Web of Science,verification,passive,verification of current state – initial state - initial final state and K step opacity,finite-state automata
142,OPACITY OF NETWORKED SUPERVISORY CONTROL SYSTEMS OVER INSECURE MULTIPLE CHANNEL NETWORKS,2019,Engineering Village-IEEExplore-Scopus-Web of Science,verification,passive,opacity verification,finite-state automata
143,REVELATION TIME FOR INITIAL-STATE OPACITY MEASUREMENT IN TIMED DISCRETE EVENT SYSTEMS,2019,IEEExplore-Scopus-Web of Science,verification,passive,initial state opacity ,Stochastic Petri nets
144,SECRET SECURING WITH MULTIPLE PROTECTIONS AND MINIMUM COSTS,2019,Complementary,verification,passive,Sct-usability aware cost levels,finite-state automata
145,COMPOSITIONAL AND ABSTRACTION-BASED APPROACH FOR SYNTHESIS OF EDIT FUNCTIONS FOR OPACITY ENFORCEMENT,2020,IEEExplore-Scopus-Web of Science,enforcement,passive,enforcement of state based opacity,finite-state automata
146,CONFIDENTIALITY OF CYBER-PHYSICAL SYSTEMS USING EVENT-BASED CRYPTOGRAPHY,2020,Engineering Village-Scopus-Science Direct-Web of Science,enforcement,passive,Event based cryptography,finite-state automata
147,CURRENT-STATE OPACITY MODELLING AND VERIFICATION IN PARTIALLY OBSERVED PETRI NETS,2020,Scopus-Science Direct-Web of Science,verification,passive,verification of current state opacity,petri nets
148,DEPTH-FIRST SEARCH APPROACH FOR LANGUAGE-BASED OPACITY VERIFICATION USING PETRI NETS,2020,Scopus-Science Direct-Web of Science,verification,passive,Verification of Language Based Opacity,petri nets
149,ENFORCING OPACITY IN MODULAR SYSTEMS,2020,Engineering Village-Scopus-Science Direct-Web of Science,verification,passive,opacity verification,Labeled Transition System (LTS)
150,HOMOMORPHIC ENCRYPTION OF SUPERVISORY CONTROL SYSTEMS USING AUTOMATA,2020,IEEExplore-Scopus-Web of Science,enforcement,passive,Homomorphic Encryption,finite-state automata
151,K-MEMORY-EMBEDDED INSERTION MECHANISM FOR OPACITY ENFORCEMENT,2020,Scopus-Science Direct-Web of Science,enforcement,passive,enforcement of current state opacity,finite-state automata
152,MATRIX APPROACH FOR VERIFICATION OF OPACITY OF PARTIALLY OBSERVED DISCRETE EVENT SYSTEMS,2020,Scopus-Web of Science,verification,passive,opacity verification,finite-state automata
153,ON OPACITY VERIFICATION FOR DISCRETE-EVENT SYSTEMS,2020,Scopus-Web of Science,verification,passive,opacity verification,finite-state automata
154,OPACITY ENFORCING SUPERVISORY CONTROL USING NON-DETERMINISTIC SUPERVISORS,2020,Science Direct,enforcement,passive,Non deterministic opacity enforcing supervisor,finite-state automata
155,SUPERVISORY CONTROL OF DISCRETE-EVENT SYSTEMS FOR INFINITE-STEP OPACITY,2020,Web of Science,enforcement,passive,infinite step opacity enforcement,finite-state automata
156,SYNTHESIS OF DYNAMIC MASKS FOR INFINITE-STEP OPACITY (2020),2020,IEEExplore-Scopus-Web of Science,enforcement,passive,infinite step opacity enforcement,finite-state automata
157,VERIFICATION OF INFINITE-STEP OPACITY USING LABELED PETRI NETS,2020,Scopus-Science Direct-Web of Science,verification,passive,inifinite step opacity verification,petri nets
158,ASSESSMENT OF BISIMULATION NON-INTERFERENCE IN DISCRETE EVENT SYSTEMS MODELLED WITH BOUNDED PETRI NETS,2021,IEEExplore-Scopus-Web of Science,verification,passive,strong non deterministic noninterference (SNNI),petri nets
159,BOUNDED OPACITY FOR TIMED SYSTEMS,2021,Scopus-Science Direct-Web of Science,verification,passive,bounded timed opacity,timed finite-state automata
160,ENFORCING CURRENT-STATE OPACITY THROUGH SHUFFLE AND DELETIONS OF EVENT OBSERVATIONS,2021,Scopus-Science Direct-Web of Science,enforcement,passive,enforcement of current state opacity,finite-state automata
161,ENFORCING STATE-BASED OPACITY USING SYNCHRONIZING AUTOMATA,2021,Web of Science,enforcement,passive,enforcement of state based opacity,finite-state automata
162,EXPOSURE AND REVELATION TIMES AS A MEASURE OF OPACITY IN TIMED STOCHASTIC DISCRETE EVENT SYSTEMS,2021,IEEExplore-Scopus-Web of Science,verification,passive,opacity exposure - opacity revelation,Stochastic Petri nets
163,LOCAL OPACITY VERIFICATION FOR DISTRIBUTED DISCRETE EVENT SYSTEMS,2021,IEEExplore-Scopus-Web of Science,verification,passive,Current state opacity and initial state opacity verification,finite-state automata
164,NONINTERFERENCE ENFORCEMENT VIA SUPERVISORY CONTROL IN BOUNDED PETRI NETS,2021,Engineering Village-IEEExplore-Scopus-Web of Science,enforcement,passive,Strong Nondeterministic Noninterference ,petri nets
165,ON APPROXIMATE OPACITY OF CYBER-PHYSICAL SYSTEMS,2021,Web of Science,verification,passive,-,finite-state automata
166,OPACITY ENFORCING SUPERVISORY CONTROL USING NON-DETERMINISTIC SUPERVISORS (2021),2021,IEEExplore-Scopus,enforcement,passive,Non deterministic opacity enforcing supervisor,finite-state automata
167,OPACITY MEASURES OF FUZZY DISCRETE EVENT SYSTEMS,2021,IEEExplore-Scopus-Web of Science,verification,passive,general fuzzy opacity – final initial fuzzy opacity,fuzzy automata
168,OPACITY OF NETWORKED DISCRETE EVENT SYSTEMS (2021),2021,Scopus-Science Direct-Web of Science,verification,passive,verification of current state – initial state - initial final state and K step opacity,finite-state automata
169,OPACITY OF NETWORKED SUPERVISORY CONTROL SYSTEMS OVER INSECURE COMMUNICATION CHANNELS,2021,Engineering Village-IEEExplore-Scopus-Web of Science,verification,passive,current-state opacity-K step opacity-infinite-step opacity,finite-state automata
170,SECURE-BY-CONSTRUCTION CONTROLLER SYNTHESIS FOR STOCHASTIC SYSTEMS UNDER LINEAR TEMPORAL LOGIC SPECIFICATIONS,2021,Web of Science,enforcement,passive,Enforcement of infinite step opacity ,Markov Decision Process (MDP)
171,USABILITY AWARE SECRET PROTECTION WITH MINIMUM COST,2021,Engineering Village-Scopus-Science Direct-Web of Science,verification,passive,Sct-usability aware cost levels,finite-state automata
172,VERIFICATION AND ENFORCEMENT OF STRONG INFINITE- AND K-STEP OPACITY USING STATE RECOGNIZERS,2021,Scopus-Science Direct-Web of Science,enforcement,passive,Verification and Enforcement of strong infinite and k step opacity,finite-state automata
173,APPLICATION OF SUPERVISORY CONTROL TO SECRET PROTECTION IN DISCRETE-EVENT SYSTEMS,2021,Complementary,verification,passive,Sct-usability aware cost levels,finite-state automata
174,A DYNAMIC OBFUSCATION FRAMEWORK FOR SECURITY AND UTILITY,2022,Complementary,enforcement,passive,distributed reactive synthesis,finite-state automata
175,OPTIMAL SECRET PROTECTIONS IN DISCRETE-EVENT SYSTEMS,2022,Web of Science,verification,passive,security automaton,finite-state automata
176,A FRAMEWORK FOR CURRENT-STATE OPACITY UNDER DYNAMIC INFORMATION RELEASE MECHANISM,2022,Scopus-Science Direct-Web of Science,verification,passive,verification of current state opacity,finite-state automata
177,A GENERAL LANGUAGE-BASED FRAMEWORK FOR SPECIFYING AND VERIFYING NOTIONS OF OPACITY,2022,Scopus-Web of Science,verification,passive,language and state based opacity,finite-state automata
178,ASSESSMENT OF MULTILEVEL INTRANSITIVE NON-INTERFERENCE FOR DISCRETE EVENT SYSTEMS,2022,IEEExplore-Scopus-Web of Science,verification,passive,Multi level intransitive non interference ,petri nets
179,ENFORCEMENT FOR INFINITE-STEP OPACITY AND K-STEP OPACITY VIA INSERTION MECHANISM,2022,Scopus-Science Direct,enforcement,passive,Enforcement of infinite step and k step opacity ,finite-state automata
180,FUZZY INFINITE-STEP OPACITY MEASURE OF DISCRETE EVENT SYSTEMS AND ITS APPLICATIONS,2022,IEEExplore-Scopus-Web of Science,verification,passive,fuzzy infinite-step opacity (FIO),fuzzy automata
181,HYPER SYMBOLIC OBSERVATION GRAPH TO ENFORCE OPACITY OF DISCRETE EVENT SYSTEMS USING SUPERVISORY CONTROL,2022,IEEExplore,enforcement,passive,state based opacity enforcement,Labeled Transition System (LTS)
182,LANGUAGE-BASED OPACITY VERIFICATION AND ENFORCEMENT IN THE FRAMEWORK OF LABELED PETRI NETS,2022,Scopus-Web of Science,enforcement,passive,Verification and Enforcement of Language based Opacity,petri nets
183,NECESSARY AND SUFFICIENT CONDITION TO ASSESS INITIAL-STATE-OPACITY IN LIVE BOUNDED AND REVERSIBLE DISCRETE EVENT SYSTEMS,2022,IEEExplore-Scopus-Web of Science,verification,passive,verification of initial state opacity,petri nets
184,SECURITY AND PRIVACY WITH OPACITY-BASED STATE OBSERVATION FOR FINITE STATE MACHINE,2022,Web of Science,verification,passive,verification of opacity,finite-state automata
185,SYMBOLIC VERIFICATION OF CURRENT-STATE OPACITY OF DISCRETE EVENT SYSTEMS USING PETRI NETS,2022,Engineering Village-IEEExplore-Scopus-Web of Science,verification,passive,Multi valued decision diagrams (MDDs) – Current-State Opacity verification,petri nets
186,VERIFICATION OF K-STEP AND INFINITE-STEP OPACITY OF BOUNDED LABELED PETRI NETS,2022,Engineering Village-Scopus-Science Direct-Web of Science,verification,passive,verification of K step and infinite step opacity,petri nets
187,ASSESSMENT OF INITIAL-STATE-OPACITY IN LIVE BOUNDED AND REVERSIBLE DISCRETE EVENT SYSTEMS VIA INTEGER LINEAR PROGRAMMING,2022,IEEExplore,verification,passive,Integer Linear Programming,petri nets
188,SECRET PROTECTIONS IN DISCRETE-EVENT SYSTEMS WITH MINIMUM COSTS,2022, Complementary,verification,passive, -,finite-state automata
189,HOW ATTACKS AFFECT DETECTABILITY IN DISCRETE-EVENT SYSTEMS?,2022,Engineering Village-IEEExplore-Scopus-Web of Science,verification,passive,,finite-state automata
190,TRANSFORMATIONS BETWEEN OPACITY FOR DISCRETE-EVENT SYSTEMS,2022,IEEExplore-Scopus,verification,passive,,finite-state automata
191,MODULAR VERIFICATION OF OPACITY FOR INTERCONNECTED CONTROL SYSTEMS VIA BARRIER CERTIFICATES,2022,IEEExplore-Scopus-Web of Science,verification,passive,,finite-state automata
192,ON TRANSFORMATIONS AMONG OPACITY NOTIONS,2022,IEEExplore,verification,passive,,finite-state automata
193,YOU DON'T KNOW WHAT I KNOW: ON NOTION OF HIGH-ORDER OPACITY IN DISCRETE-EVENT SYSTEMS,2022,Science Direct-Web of Science,verification,passive,,finite-state automata
194,EVENT-BASED CRYPTOGRAPHY FOR AUTOMATION NETWORKS OF CYBER-PHYSICAL SYSTEMS USING THE STREAM CIPHER CHACHA20,2022,Science Direct-Web of Science,enforcement,passive,cryptpgraphy,finite-state automata
195,OPTIMAL SUPERVISORY CONTROL OF OPACITY FOR MODULAR SYSTEMS,2022,IEEExplore,enforcement,passive,,Labeled Transition System (LTS)
196,VERIFICATION OF STRONG K-STEP OPACITY FOR DISCRETE-EVENT SYSTEMS,2022,IEEExplore,verification,passive,,finite-state automata
197,ON VERIFICATION OF WEAK AND STRONG K-STEP OPACITY FOR DISCRETE-EVENT SYSTEMS,2022,Web of Science,verification,passive,,finite-state automata
198,ENSURING CONFIDENTIALITY OF CYBER-PHYSICAL SYSTEMS USING EVENT-BASED CRYPTOGRAPHY,2023,Engineering Village-Scopus-Science Direct,enforcement,passive,Event-based cryptography,finite-state automata
199,ACTIVE OPACITY OF DISCRETE-EVENT SYSTEMS,2023,Engineering Village-Scopus,verification,passive,active current-state opacity ,finite-state automata
200,SECURE YOUR INTENTION: ON NOTIONS OF PRE-OPACITY IN DISCRETE-EVENT SYSTEMS,2023,IEEExplore-Scopus,verification,passive,preopacity,finite-state automata
201,EDIT MECHANISM SYNTHESIS FOR OPACITY ENFORCEMENT UNDER UNCERTAIN OBSERVATIONS,2023,IEEExplore-Scopus-Web of Science,enforcement,passive,opacity,finite-state automata
202,ABSTRACTION-BASED VERIFICATION OF APPROXIMATE PREOPACITY FOR CONTROL SYSTEMS,2023,IEEExplore-Scopus-Web of Science,verification,passive,preopacity,finite-state automata
203,STRONG CURRENT-STATE AND INITIAL-STATE OPACITY OF DISCRETE-EVENT SYSTEMS,2023,Scopus-Science Direct,verification,passive,strong opacity,finite-state automata
204,ASSESSMENT OF INITIAL-STATE-OPACITY IN LIVE AND BOUNDED LABELED PETRI NET SYSTEMS VIA OPTIMIZATION TECHNIQUES,2023,Scopus-Science Direct-Web of Science,verification,passive,initial state opacity,petri nets
205,STATE-BASED DIFFERENTIAL PRIVACY VERIFICATION AND ENFORCEMENT FOR PROBABILISTIC AUTOMATA,2023,Scopus-Web of Science,verification,passive,State-Based Differential Privacy,probabilistic finite-state automata
206,VERIFYING WEAK AND STRONG K-STEP OPACITY IN DISCRETE-EVENT SYSTEMS,2023,Scopus-Science Direct,verification,passive,weak and strong k-step opacity,finite-state automata
207,ON SECURING CRYPTOGRAPHIC ICS AGAINST SCAN-BASED ATTACKS: A HAMMING WEIGHT DISTRIBUTION PERSPECTIVE,2023,Scopus,verification,passive,cryptography and opacity,finite-state automata
208,STP-BASED VERIFICATION AND SYNTHESIS OF STATE OPACITY FOR LOGICAL FINITE STATE MACHINES,2023,Web of Science,verification,passive,,finite-state automata
